{
  "schema": "TSAO-EPDM-A15-INTEGRATION-REQUEST-1",
  "parameter_set_id": "A15-PARAMETER-BUNDLE:c763f781ce41fda624df812539be375ead7f34c3094db2f8b110eef3f257e1d7",
  "rate_package_id": "A3-RATE-PACKAGE:EPDM-V2-TERMINAL-NETWORK-1",
  "state_layout_id": "EPDM-V2-STATE-A15-FIXTURE:L2:GENERATED",
  "network_id": "EPDM-V2-TERMINAL-NETWORK-1",
  "integration_method": "ADAPTIVE_DORMAND_PRINCE_54",
  "time_start_s": 0.0,
  "time_end_s": 1.0,
  "initial_step_s": 0.05,
  "minimum_step_s": 1e-08,
  "maximum_step_s": 0.2,
  "relative_tolerance": 1e-07,
  "absolute_tolerance": 1e-10,
  "maximum_steps": 10000,
  "nonnegative_state_policy": "REJECT_REDUCE_ROUNDOFF_CLAMP",
  "conservation_policy": "REQUIRE_A3_INTERNAL_AND_TRAJECTORY",
  "applicability_decision": "REQUIRE_PASS",
  "reason_code": "A15_REQUEST_VALIDATED",
  "software_qualification": "A15_ADAPTIVE_INTEGRATOR_SOFTWARE",
  "scientific_technical_approval": "NOT_EVALUATED",
  "nonnegative_tolerance": 1e-12,
  "maximum_consecutive_rejections": 12
}
